{
    "services": {
        "discord": {
            "webhook": "DiscordWebhook",
            "user_id": "123456789"
        },
        "slack": {
            "webhook": "SlackWebhook",
            "user_id": "A1B2C3D4E5"
        },
        "teams": {
            "webhook": "TeamsWebhook",
            "user_id": "user@domain.tld",
            "user_name": "Your Name"
        },
        "telegram": {
            "token": "",
            "chat_id": ""
        }
    },
    "mentions": {
        "on_failure": false,
        "on_warning": false
    },
    "notifications": {
        "on_success": true,
        "on_failure": true,
        "on_warning": true
    },
    "logging": {
        "enabled": true,
        "level": "info",
        "max_age_days": 7
    },
    "update": {
        "notify": true,
        "auto_update": false,
        "auto_update_comment": "auto_update will NOT work. Leave as 'false'"
    },
    "thumbnail": "https://raw.githubusercontent.com/tigattack/VeeamDiscordNotifications/master/asset/thumb01.png"
}
