{
    "services": {
        "discord": {
            "enabled": false,
            "webhook": "DiscordWebhook",
            "user_id": "123456789"
        },
        "slack": {
            "enabled": false,
            "webhook": "SlackWebhook",
            "user_id": "A1B2C3D4E5"
        },
        "teams": {
            "enabled": false,
            "webhook": "TeamsWebhook",
            "user_id": "user@domain.tld",
            "display_name": "Your Name"
        },
        "telegram": {
            "enabled": false,
            "bot_token": "TelegramBotToken",
            "chat_id": "TelegramChatID",
            "user_name": "yourusername"
        },
        "http": {
            "enabled": false,
            "url": "EndpointURL",
            "method": "POST"
        }
    },
    "mentions": {
        "on_failure": false,
        "on_warning": false,
        "on_success": false
    },
    "notifications": {
        "on_success": true,
        "on_failure": true,
        "on_warning": true
    },
    "logging": {
        "enabled": true,
        "level": "info",
        "max_age_days": 7
    },
    "update": {
        "notify": true,
        "auto_update": false,
        "auto_update_comment": "auto_update is not yet implemented. This will do nothing even if 'true'."
    },
    "thumbnail": "https://raw.githubusercontent.com/tigattack/VeeamNotify/main/asset/thumb01.png"
}
